mcq,options,correct
What is biology?,a: The study of rocks|b: The scientific study of life|c: The study of stars|d: The study of economics,b
What is a major theme in biology that explains the unity and diversity of life?,a: Energy processing|b: Evolution|c: Chemistry|d: Physics,b
What is the importance of energy processing in organisms?,"a: Allows organisms to communicate|b: Allows organisms to move, grow, and reproduce|c: Allows organisms to fly|d: Allows organisms to hibernate",b
What is a key characteristic of all organisms mentioned in the text?,a: They all have wings|b: They are all made up of cells|c: They all live in water|d: They all have fur,b
What is a subdiscipline within biology?,a: The study of economics|b: The study of stars|c: The study of rocks|d: The study of molecular biology,d
